{
  "$schema": "https://json-schema.org/draft/2020-12/schema",
  "title": "Pagina met opdrachten",
  "description": "Lijst van opdrachten.",
  "type": "object",
  "properties": {
    "results": {
      "type": "array",
      "description": "Opdrachten.",
      "items": {
        "$ref": "assignment.schema.json"
      }
    },
    "page": {
      "type": "integer",
      "minimum": 1,
      "description": "Paginanummer, vanaf 1."
    },
    "page_size": {
      "type": "integer",
      "minimum": 1,
      "maximum": 100,
      "description": "Aantal resultaten per pagina."
    },
    "total": {
      "type": "integer",
      "minimum": 0,
      "description": "Totaal aantal resultaten."
    }
  },
  "required": [
    "results",
    "page",
    "page_size"
  ]
}
